{
  "schema_version": "abuse-identity-enforcement-request-v0",
  "request_class": "preflight_only",
  "objective_item": 11,
  "surface": "abuse_identity_ban_operations",
  "status": "blocked",
  "requested_operation": {
    "action": "ban",
    "case_digest": "sha256:1111111111111111111111111111111111111111111111111111111111111111",
    "actor_ref": {
      "ref_kind": "opaque_preflight_actor_ref",
      "ref_digest": "sha256:aaaaaaaaaaaaaaaaaaaaaaaaaaaaaaaaaaaaaaaaaaaaaaaaaaaaaaaaaaaaaaaa"
    },
    "target_subject": {
      "ref_kind": "opaque_preflight_subject_ref",
      "ref_digest": "sha256:2222222222222222222222222222222222222222222222222222222222222222"
    },
    "purpose": "abuse_preflight",
    "reason_class": "ban_evasion",
    "decision_digest": "sha256:3333333333333333333333333333333333333333333333333333333333333333",
    "idempotency_digest": "sha256:4444444444444444444444444444444444444444444444444444444444444444"
  },
  "authorization_model": {
    "actor_role_model_accepted": false,
    "high_risk_review_required_for": ["suspend", "ban"],
    "two_person_review_required_for": ["ban"],
    "self_service_enforcement_allowed": false,
    "service_account_enforcement_allowed": false
  },
  "anti_enumeration_contract": {
    "no_subject_existence_disclosure": true,
    "no_match_count_disclosure": true,
    "positive_negative_response_equivalence": true,
    "timing_equalization_required": true,
    "generic_error_contract_required": true,
    "lockout_status_disclosure": "none",
    "rate_limit_reason_disclosure": "generic_only"
  },
  "identity_minimization_contract": {
    "raw_identifier_collection": "forbidden",
    "protected_fingerprint_creation": "forbidden_in_preflight",
    "subject_row_creation": "forbidden_in_preflight",
    "identity_assurance_mode": "not_performed",
    "purpose_binding": "abuse_preflight_only",
    "retention_profile_required_before_real_data": true
  },
  "identity_resolution": {
    "mode": "not_performed",
    "raw_identity_values": "forbidden_in_fixture",
    "protected_fingerprint_profile": "required_before_real_data",
    "protected_fingerprint_created": false,
    "subject_rows": "none",
    "real_subject_rows_created": false,
    "match_status_disclosure": "none",
    "normalized_outward_response": "generic_no_match_disclosure"
  },
  "enforcement_model": {
    "real_enforcement_enabled": false,
    "transitions": [
      {"action": "warn", "real_effect_enabled": false, "requires_audit_event": true},
      {"action": "rate_limit", "real_effect_enabled": false, "requires_audit_event": true},
      {"action": "hold_for_review", "real_effect_enabled": false, "requires_audit_event": true},
      {"action": "suspend", "real_effect_enabled": false, "requires_audit_event": true},
      {"action": "ban", "real_effect_enabled": false, "requires_audit_event": true},
      {"action": "appeal", "real_effect_enabled": false, "requires_audit_event": true},
      {"action": "reinstate", "real_effect_enabled": false, "requires_audit_event": true},
      {"action": "revoke", "real_effect_enabled": false, "requires_audit_event": true},
      {"action": "purge", "real_effect_enabled": false, "requires_audit_event": true}
    ]
  },
  "required_gates": [
    "ED-006",
    "TNS-001",
    "AUTHORIZATION_ROLE_MODEL",
    "HIGH_RISK_REVIEW_POLICY",
    "IDEMPOTENCY_WRITE_BEFORE_EFFECT",
    "ANTI_ENUMERATION_CONTRACT",
    "IDENTITY_MINIMIZATION_POLICY",
    "PROTECTED_FINGERPRINT_PROFILE",
    "AUDIT_DURABILITY",
    "NO_IDENTITY_DISCLOSURE_NEGATIVE_TESTS",
    "RAW_IDENTITY_RETENTION_PURGE_POLICY",
    "APPEAL_RECOVERY_PATH"
  ],
  "forbidden_outputs": [
    "submitter_identity",
    "raw_identity_values",
    "subject_row",
    "device_or_network_signal",
    "reidentification_hint",
    "protected_fingerprint",
    "raw_source_material",
    "source_metadata",
    "raw_moderation_evidence",
    "match_status",
    "account_identifier",
    "private_selection_status"
  ],
  "output_contract": {
    "requested_outputs": ["redacted_case_status", "preflight_blocked_reason", "generic_status"],
    "withheld_outputs": [
      "submitter_identity",
      "raw_identity_values",
      "subject_row",
      "device_or_network_signal",
      "reidentification_hint",
      "protected_fingerprint",
      "raw_source_material",
      "source_metadata",
      "raw_moderation_evidence",
      "match_status",
      "account_identifier",
      "private_selection_status"
    ]
  },
  "audit_event_mapping": {
    "audit_event_write_enabled": false,
    "preflight_required_events": ["case_opened", "identity_signal_reviewed"],
    "transition_events": [
      {"action": "warn", "audit_event_type": "account_warned"},
      {"action": "rate_limit", "audit_event_type": "account_rate_limited"},
      {"action": "hold_for_review", "audit_event_type": "submission_held"},
      {"action": "suspend", "audit_event_type": "account_suspended"},
      {"action": "ban", "audit_event_type": "account_banned"},
      {"action": "appeal", "audit_event_type": "appeal_opened"},
      {"action": "reinstate", "audit_event_type": "reinstated"},
      {"action": "revoke", "audit_event_type": "artifact_revoked"},
      {"action": "purge", "audit_event_type": "artifact_purged"}
    ]
  },
  "audit_event_contract": {
    "audit_write_mode": "disabled_preflight_only",
    "required_event_fields": [
      "case_id",
      "actor_id",
      "purpose",
      "reason_class",
      "decision_digest",
      "subject_ref",
      "appeal_ref",
      "created_at"
    ],
    "raw_evidence_in_audit": "forbidden"
  },
  "appeal_recovery": {
    "required_for": ["suspend", "ban"],
    "appeal_path_required": true,
    "reinstatement_path_required": true,
    "appeal_path_accepted": false,
    "reinstatement_path_accepted": false
  },
  "appeal_recovery_contract": {
    "generic_notice_required": true,
    "appeal_ref_required_for": ["suspend", "ban"],
    "mistaken_identity_recovery_required": true,
    "appeal_status_disclosure": "generic_only"
  },
  "surface_enablement": {
    "identity_processing_enabled": false,
    "real_enforcement_enabled": false,
    "real_ban_operations_enabled": false,
    "protected_fingerprint_creation_enabled": false,
    "subject_row_creation_enabled": false,
    "actual_experience_storage_enabled": false,
    "public_candidate_conversion_enabled": false,
    "public_serving_enabled": false,
    "b2b_delivery_enabled": false,
    "respondent_inquiry_enabled": false,
    "dashboard_enabled": false,
    "retrieval_enabled": false,
    "export_enabled": false,
    "ranking_enabled": false,
    "raw_detail_escrow_enabled": false
  },
  "result_contract": {
    "command_effect": "preflight_only",
    "performs_identity_processing": false,
    "stores_raw_identity": false,
    "creates_subject_row": false,
    "creates_protected_fingerprint": false,
    "discloses_match_status": false,
    "enforces_ban": false,
    "enforces_rate_limit": false,
    "creates_suspension": false,
    "opens_appeal_case": false,
    "opens_public_surface": false,
    "delivers_to_b2b": false,
    "serves_dashboard": false,
    "stores_raw_detail": false,
    "writes_audit_event": false
  },
  "blocked_until": [
    {
      "gate": "ED-006",
      "reason": "Abuse identity lane scaffold is not accepted for real enforcement."
    },
    {
      "gate": "TNS-001",
      "reason": "Trust-and-safety audit schema is not accepted for real identity operations."
    },
    {
      "gate": "AUTHORIZATION_ROLE_MODEL",
      "reason": "Actor role model is not accepted for real enforcement."
    },
    {
      "gate": "HIGH_RISK_REVIEW_POLICY",
      "reason": "High-risk and two-person review policy is not accepted."
    },
    {
      "gate": "IDEMPOTENCY_WRITE_BEFORE_EFFECT",
      "reason": "Idempotent write-before-effect controls are not accepted."
    },
    {
      "gate": "ANTI_ENUMERATION_CONTRACT",
      "reason": "Anti-enumeration contract is not accepted for real identity operations."
    },
    {
      "gate": "IDENTITY_MINIMIZATION_POLICY",
      "reason": "Identity minimization policy is not accepted for real data."
    },
    {
      "gate": "PROTECTED_FINGERPRINT_PROFILE",
      "reason": "Protected fingerprint profile is not accepted."
    },
    {
      "gate": "AUDIT_DURABILITY",
      "reason": "Durable audit write-before-effect path is not accepted."
    },
    {
      "gate": "NO_IDENTITY_DISCLOSURE_NEGATIVE_TESTS",
      "reason": "Negative tests do not yet prove no identity disclosure across respondent and dashboard surfaces."
    },
    {
      "gate": "RAW_IDENTITY_RETENTION_PURGE_POLICY",
      "reason": "Raw identity retention, access audit, and purge policy is not accepted."
    },
    {
      "gate": "APPEAL_RECOVERY_PATH",
      "reason": "Appeal and reinstatement paths are not accepted."
    }
  ]
}
